{
  "ambiguous_delivery_count": 0,
  "billing_failed_no_output_positions": 26,
  "canonical_positions": [
    {
      "attempt_count": 1,
      "cell_id": "G0",
      "event_id": "ev_eda32c84a9cf2952b292",
      "next_attempt_number": null,
      "output_sha256": "71ee58d298e548dc1999e25ab20a8e1e55bc601307c35252bdca0d918786a2c7",
      "position_id": "ev_eda32c84a9cf2952b292/G0/rep-1",
      "repetition": 1,
      "request_sha256": "5f73f56dfa995e0e266dfe54c7dff8187c1fb887c7e03821b355ea76b2f7590b",
      "role": "completed_model_response",
      "status": "DELIVERED",
      "unsent_attempt_directories": []
    },
    {
      "attempt_count": 1,
      "cell_id": "G0",
      "event_id": "ev_eda32c84a9cf2952b292",
      "next_attempt_number": null,
      "output_sha256": "18adf31d4ddbe202240084694c05fba7a79a188a8206864a6797040eb781c735",
      "position_id": "ev_eda32c84a9cf2952b292/G0/rep-2",
      "repetition": 2,
      "request_sha256": "5f73f56dfa995e0e266dfe54c7dff8187c1fb887c7e03821b355ea76b2f7590b",
      "role": "completed_model_response",
      "status": "DELIVERED",
      "unsent_attempt_directories": []
    },
    {
      "attempt_count": 1,
      "cell_id": "G0",
      "event_id": "ev_eda32c84a9cf2952b292",
      "next_attempt_number": null,
      "output_sha256": "6590903d173d0844d86cc91e23724d91dac06ea2f909fc71ea042982bbf90769",
      "position_id": "ev_eda32c84a9cf2952b292/G0/rep-3",
      "repetition": 3,
      "request_sha256": "5f73f56dfa995e0e266dfe54c7dff8187c1fb887c7e03821b355ea76b2f7590b",
      "role": "completed_model_response",
      "status": "DELIVERED",
      "unsent_attempt_directories": []
    },
    {
      "attempt_count": 1,
      "cell_id": "G1-E",
      "event_id": "ev_eda32c84a9cf2952b292",
      "next_attempt_number": null,
      "output_sha256": "96d5184db31e218fd6cccd442d82237ad422d9057d1681c3f2862e2c96471e4b",
      "position_id": "ev_eda32c84a9cf2952b292/G1-E/rep-1",
      "repetition": 1,
      "request_sha256": "2fc1c56da92cc70ba9c2f30f694b2f4a99ec6a137c04c213751c238e9c947adb",
      "role": "completed_model_response",
      "status": "DELIVERED",
      "unsent_attempt_directories": []
    },
    {
      "attempt_count": 1,
      "cell_id": "G1-E",
      "event_id": "ev_eda32c84a9cf2952b292",
      "next_attempt_number": null,
      "output_sha256": "ec4c586a741ce8a3219e0c73201d3aa217a3361b49d299a6a75e6afdab7ae986",
      "position_id": "ev_eda32c84a9cf2952b292/G1-E/rep-2",
      "repetition": 2,
      "request_sha256": "2fc1c56da92cc70ba9c2f30f694b2f4a99ec6a137c04c213751c238e9c947adb",
      "role": "completed_model_response",
      "status": "DELIVERED",
      "unsent_attempt_directories": []
    },
    {
      "attempt_count": 1,
      "cell_id": "G1-E",
      "event_id": "ev_eda32c84a9cf2952b292",
      "next_attempt_number": null,
      "output_sha256": "3b493a987c82f616a25c2fbb1ffc18cf35827401b1f1e97578d2602d3f647363",
      "position_id": "ev_eda32c84a9cf2952b292/G1-E/rep-3",
      "repetition": 3,
      "request_sha256": "2fc1c56da92cc70ba9c2f30f694b2f4a99ec6a137c04c213751c238e9c947adb",
      "role": "completed_model_response",
      "status": "DELIVERED",
      "unsent_attempt_directories": []
    },
    {
      "attempt_count": 1,
      "cell_id": "G1-N",
      "event_id": "ev_eda32c84a9cf2952b292",
      "next_attempt_number": null,
      "output_sha256": "a7630e5821f11cc1cac960a4e489b71a55cc56dca33901ccb38495ed37a3e3c4",
      "position_id": "ev_eda32c84a9cf2952b292/G1-N/rep-1",
      "repetition": 1,
      "request_sha256": "8cce00b10367411f05b41089615ac29179d94229bafa12578dc73ea0224a2c68",
      "role": "completed_model_response",
      "status": "DELIVERED",
      "unsent_attempt_directories": []
    },
    {
      "attempt_count": 1,
      "cell_id": "G1-N",
      "event_id": "ev_eda32c84a9cf2952b292",
      "next_attempt_number": null,
      "output_sha256": "80cbf5978d1013d03cd663b98017a41cee5bee0da2e7d440de4c6f6ef11dfc73",
      "position_id": "ev_eda32c84a9cf2952b292/G1-N/rep-2",
      "repetition": 2,
      "request_sha256": "8cce00b10367411f05b41089615ac29179d94229bafa12578dc73ea0224a2c68",
      "role": "completed_model_response",
      "status": "DELIVERED",
      "unsent_attempt_directories": []
    },
    {
      "attempt_count": 1,
      "cell_id": "G1-N",
      "event_id": "ev_eda32c84a9cf2952b292",
      "next_attempt_number": null,
      "output_sha256": "c22e7b94c6f0a0c0a539bf74fd9f0f952ab3607bf3fd9253ad1e5d64ec7d0507",
      "position_id": "ev_eda32c84a9cf2952b292/G1-N/rep-3",
      "repetition": 3,
      "request_sha256": "8cce00b10367411f05b41089615ac29179d94229bafa12578dc73ea0224a2c68",
      "role": "completed_model_response",
      "status": "DELIVERED",
      "unsent_attempt_directories": []
    },
    {
      "attempt_count": 1,
      "cell_id": "G1-EN",
      "event_id": "ev_eda32c84a9cf2952b292",
      "next_attempt_number": null,
      "output_sha256": "6624f255e3664a17c7a5f6eb1486c63f0bbc074891aacb06a2fdbb7e471d0491",
      "position_id": "ev_eda32c84a9cf2952b292/G1-EN/rep-1",
      "repetition": 1,
      "request_sha256": "3b010e5d293d72085f82a53f8f8120269040e9890694ddaa1bcecdac7c0dd911",
      "role": "completed_model_response",
      "status": "DELIVERED",
      "unsent_attempt_directories": []
    },
    {
      "attempt_count": 1,
      "cell_id": "G1-EN",
      "event_id": "ev_eda32c84a9cf2952b292",
      "next_attempt_number": null,
      "output_sha256": "3d2f73d2e787d7f74c66f1d37b13c4fb4435db3bdfb75e52e0faec3c77518392",
      "position_id": "ev_eda32c84a9cf2952b292/G1-EN/rep-2",
      "repetition": 2,
      "request_sha256": "3b010e5d293d72085f82a53f8f8120269040e9890694ddaa1bcecdac7c0dd911",
      "role": "completed_model_response",
      "status": "DELIVERED",
      "unsent_attempt_directories": []
    },
    {
      "attempt_count": 1,
      "cell_id": "G1-EN",
      "event_id": "ev_eda32c84a9cf2952b292",
      "next_attempt_number": null,
      "output_sha256": "16b17cbb28532dd944f67117af39e49ae256d9c10c96f5c9b7c801fb127d4737",
      "position_id": "ev_eda32c84a9cf2952b292/G1-EN/rep-3",
      "repetition": 3,
      "request_sha256": "3b010e5d293d72085f82a53f8f8120269040e9890694ddaa1bcecdac7c0dd911",
      "role": "completed_model_response",
      "status": "DELIVERED",
      "unsent_attempt_directories": []
    },
    {
      "attempt_count": 1,
      "cell_id": "G0",
      "event_id": "ev_54ead6013ea77949d028",
      "next_attempt_number": null,
      "output_sha256": "d6551d593ca7d366cf7ccc720008407b354d13c070439a63bcce907c0008b7cf",
      "position_id": "ev_54ead6013ea77949d028/G0/rep-1",
      "repetition": 1,
      "request_sha256": "9f7c1f50fd7a7eb62200ed7d4816fad902fd5221391ea5d17d8a2c905d856488",
      "role": "completed_model_response",
      "status": "DELIVERED",
      "unsent_attempt_directories": []
    },
    {
      "attempt_count": 1,
      "cell_id": "G0",
      "event_id": "ev_54ead6013ea77949d028",
      "next_attempt_number": null,
      "output_sha256": "0465d9ccde7f83557ebc099426af22ad979dd44a55b084785b614edb9e2b7895",
      "position_id": "ev_54ead6013ea77949d028/G0/rep-2",
      "repetition": 2,
      "request_sha256": "9f7c1f50fd7a7eb62200ed7d4816fad902fd5221391ea5d17d8a2c905d856488",
      "role": "completed_model_response",
      "status": "DELIVERED",
      "unsent_attempt_directories": []
    },
    {
      "attempt_count": 1,
      "cell_id": "G0",
      "event_id": "ev_54ead6013ea77949d028",
      "next_attempt_number": null,
      "output_sha256": "31893fef18b72eec5d418cc025d7613416a00b425de9d380c851df803a7719df",
      "position_id": "ev_54ead6013ea77949d028/G0/rep-3",
      "repetition": 3,
      "request_sha256": "9f7c1f50fd7a7eb62200ed7d4816fad902fd5221391ea5d17d8a2c905d856488",
      "role": "completed_model_response",
      "status": "DELIVERED",
      "unsent_attempt_directories": []
    },
    {
      "attempt_count": 1,
      "cell_id": "G1-E",
      "event_id": "ev_54ead6013ea77949d028",
      "next_attempt_number": null,
      "output_sha256": "68fbad36ee65fc834216ef7232d9e1bcfd6fe62951904acf91b2ccea676e53fc",
      "position_id": "ev_54ead6013ea77949d028/G1-E/rep-1",
      "repetition": 1,
      "request_sha256": "a4cd514d7daad39a8ced6b676267ae7ef0e3c69da583eb69d0ccbad887dcb1b7",
      "role": "completed_model_response",
      "status": "DELIVERED",
      "unsent_attempt_directories": []
    },
    {
      "attempt_count": 1,
      "cell_id": "G1-E",
      "event_id": "ev_54ead6013ea77949d028",
      "next_attempt_number": null,
      "output_sha256": "9f4463467da1de1d5699fc888fcd936e30b464f9f26769890e1bc5afe47f7655",
      "position_id": "ev_54ead6013ea77949d028/G1-E/rep-2",
      "repetition": 2,
      "request_sha256": "a4cd514d7daad39a8ced6b676267ae7ef0e3c69da583eb69d0ccbad887dcb1b7",
      "role": "completed_model_response",
      "status": "DELIVERED",
      "unsent_attempt_directories": []
    },
    {
      "attempt_count": 1,
      "cell_id": "G1-E",
      "event_id": "ev_54ead6013ea77949d028",
      "next_attempt_number": null,
      "output_sha256": "f68ae9d0aa5b58d1e4414b1ee33e2481fdec706d5590e1496fa104dc0b1e864f",
      "position_id": "ev_54ead6013ea77949d028/G1-E/rep-3",
      "repetition": 3,
      "request_sha256": "a4cd514d7daad39a8ced6b676267ae7ef0e3c69da583eb69d0ccbad887dcb1b7",
      "role": "completed_model_response",
      "status": "DELIVERED",
      "unsent_attempt_directories": []
    },
    {
      "attempt_count": 1,
      "cell_id": "G1-N",
      "event_id": "ev_54ead6013ea77949d028",
      "next_attempt_number": null,
      "output_sha256": "c51c124dd4f95c03b1759d8746657d7b7f529ebc5fa839326028751d01642f0d",
      "position_id": "ev_54ead6013ea77949d028/G1-N/rep-1",
      "repetition": 1,
      "request_sha256": "2ab3174a5cb4876737d450c1bb17decb12101e3346c986d7e706c18e83d914d3",
      "role": "completed_model_response",
      "status": "DELIVERED",
      "unsent_attempt_directories": []
    },
    {
      "attempt_count": 1,